[
  {
    "record_id": "ECR-DREROS-1-WIKIPEDIA-174295509",
    "source_id": "Dreros 1",
    "authority": "Wikipedia contributors, Idioma eteocretense",
    "language": "ecr",
    "label": "Dreros 1 (secondary reference)",
    "category": "secondary_reference",
    "unit": "attributed_reading_version",
    "object_id": "ECR-DREROS-1",
    "independent_witness_count": null,
    "source": {
      "url": "https://es.wikipedia.org/w/index.php?title=Idioma_eteocretense&oldid=174295509",
      "evidence_path": "data/raw/wikipedia-es.html",
      "sha256": "9b0773ac02f23ded6d6999766c407e5c792a23dcdad2586c70e5a31e791edb65",
      "license": "CC-BY-SA-4.0",
      "locator": "Dreros 1",
      "changes": "Extracted attributed reading blocks; structured language partitions; no modern interpretation imported."
    },
    "source_level": "secondary_reference",
    "default_reading": false,
    "lines": [
      {
        "source_row": 0,
        "source_locator": "HTML element #mwTA",
        "label": "1",
        "text": "---rmaw|et|isalabre|komn",
        "representation": "secondary_roman_transcription",
        "partition": "ecr",
        "partition_evidence": "Wikipedia section description; secondary attribution only",
        "analysis_eligible": false,
        "annotations": {
          "injured": false,
          "uncertain": true,
          "note": "Secondary transcription; not independently collated. Spaces and vacat labels preserved."
        },
        "tokens": [
          {
            "text": "---rmaw",
            "start": 0,
            "end": 7,
            "eligible": false,
            "reason": "source_marks_line_as_injured_or_uncertain"
          },
          {
            "text": "et",
            "start": 8,
            "end": 10,
            "eligible": false,
            "reason": "source_marks_line_as_injured_or_uncertain"
          },
          {
            "text": "isalabre",
            "start": 11,
            "end": 19,
            "eligible": false,
            "reason": "source_marks_line_as_injured_or_uncertain"
          },
          {
            "text": "komn",
            "start": 20,
            "end": 24,
            "eligible": false,
            "reason": "source_marks_line_as_injured_or_uncertain"
          }
        ]
      },
      {
        "source_row": 1,
        "source_locator": "HTML element #mwTg",
        "label": "2",
        "text": "---d|men|inai|isaluria|lmo",
        "representation": "secondary_roman_transcription",
        "partition": "ecr",
        "partition_evidence": "Wikipedia section description; secondary attribution only",
        "analysis_eligible": false,
        "annotations": {
          "injured": false,
          "uncertain": true,
          "note": "Secondary transcription; not independently collated. Spaces and vacat labels preserved."
        },
        "tokens": [
          {
            "text": "---d",
            "start": 0,
            "end": 4,
            "eligible": false,
            "reason": "source_marks_line_as_injured_or_uncertain"
          },
          {
            "text": "men",
            "start": 5,
            "end": 8,
            "eligible": false,
            "reason": "source_marks_line_as_injured_or_uncertain"
          },
          {
            "text": "inai",
            "start": 9,
            "end": 13,
            "eligible": false,
            "reason": "source_marks_line_as_injured_or_uncertain"
          },
          {
            "text": "isaluria",
            "start": 14,
            "end": 22,
            "eligible": false,
            "reason": "source_marks_line_as_injured_or_uncertain"
          },
          {
            "text": "lmo",
            "start": 23,
            "end": 26,
            "eligible": false,
            "reason": "source_marks_line_as_injured_or_uncertain"
          }
        ]
      },
      {
        "source_row": 2,
        "source_locator": "HTML element #mwUw",
        "label": "3",
        "text": "----tonturonmēa.oaoiewad",
        "representation": "secondary_roman_transcription",
        "partition": "grc",
        "partition_evidence": "Wikipedia section description; secondary attribution only",
        "analysis_eligible": false,
        "annotations": {
          "injured": false,
          "uncertain": true,
          "note": "Secondary transcription; not independently collated. Spaces and vacat labels preserved."
        },
        "tokens": [
          {
            "text": "----tonturonmēa.oaoiewad",
            "start": 0,
            "end": 24,
            "eligible": false,
            "reason": "source_marks_line_as_injured_or_uncertain"
          }
        ]
      },
      {
        "source_row": 3,
        "source_locator": "HTML element #mwVQ",
        "label": "4",
        "text": "eturo---munadoa-enē--",
        "representation": "secondary_roman_transcription",
        "partition": "grc",
        "partition_evidence": "Wikipedia section description; secondary attribution only",
        "analysis_eligible": false,
        "annotations": {
          "injured": false,
          "uncertain": true,
          "note": "Secondary transcription; not independently collated. Spaces and vacat labels preserved."
        },
        "tokens": [
          {
            "text": "eturo---munadoa-enē--",
            "start": 0,
            "end": 21,
            "eligible": false,
            "reason": "source_marks_line_as_injured_or_uncertain"
          }
        ]
      },
      {
        "source_row": 4,
        "source_locator": "HTML element #mwVw",
        "label": "5",
        "text": "--matritaia--",
        "representation": "secondary_roman_transcription",
        "partition": "grc",
        "partition_evidence": "Wikipedia section description; secondary attribution only",
        "analysis_eligible": false,
        "annotations": {
          "injured": false,
          "uncertain": true,
          "note": "Secondary transcription; not independently collated. Spaces and vacat labels preserved."
        },
        "tokens": [
          {
            "text": "--matritaia--",
            "start": 0,
            "end": 13,
            "eligible": false,
            "reason": "source_marks_line_as_injured_or_uncertain"
          }
        ]
      }
    ]
  },
  {
    "record_id": "ECR-DREROS-2-WIKIPEDIA-174295509",
    "source_id": "Dreros 2",
    "authority": "Wikipedia contributors, Idioma eteocretense",
    "language": "ecr",
    "label": "Dreros 2 (secondary reference)",
    "category": "secondary_reference",
    "unit": "attributed_reading_version",
    "object_id": "ECR-DREROS-2",
    "independent_witness_count": null,
    "source": {
      "url": "https://es.wikipedia.org/w/index.php?title=Idioma_eteocretense&oldid=174295509",
      "evidence_path": "data/raw/wikipedia-es.html",
      "sha256": "9b0773ac02f23ded6d6999766c407e5c792a23dcdad2586c70e5a31e791edb65",
      "license": "CC-BY-SA-4.0",
      "locator": "Dreros 2",
      "changes": "Extracted attributed reading blocks; structured language partitions; no modern interpretation imported."
    },
    "source_level": "secondary_reference",
    "default_reading": false,
    "lines": [
      {
        "source_row": 0,
        "source_locator": "HTML element #mwiQ",
        "label": "1",
        "text": "--S|TUPRMĒRIĒIA",
        "representation": "secondary_roman_transcription",
        "partition": "ecr",
        "partition_evidence": "Wikipedia section description; secondary attribution only",
        "analysis_eligible": false,
        "annotations": {
          "injured": false,
          "uncertain": true,
          "note": "Secondary transcription; not independently collated. Spaces and vacat labels preserved."
        },
        "tokens": [
          {
            "text": "--S",
            "start": 0,
            "end": 3,
            "eligible": false,
            "reason": "source_marks_line_as_injured_or_uncertain"
          },
          {
            "text": "TUPRMĒRIĒIA",
            "start": 4,
            "end": 15,
            "eligible": false,
            "reason": "source_marks_line_as_injured_or_uncertain"
          }
        ]
      },
      {
        "source_row": 1,
        "source_locator": "HTML element #mwbw",
        "label": "2",
        "text": "saidaperenorkioisi|a-- ",
        "representation": "secondary_roman_transcription",
        "partition": "grc",
        "partition_evidence": "Wikipedia section description; secondary attribution only",
        "analysis_eligible": false,
        "annotations": {
          "injured": false,
          "uncertain": true,
          "note": "Secondary transcription; not independently collated. Spaces and vacat labels preserved."
        },
        "tokens": [
          {
            "text": "saidaperenorkioisi",
            "start": 0,
            "end": 18,
            "eligible": false,
            "reason": "source_marks_line_as_injured_or_uncertain"
          },
          {
            "text": "a--",
            "start": 19,
            "end": 22,
            "eligible": false,
            "reason": "source_marks_line_as_injured_or_uncertain"
          }
        ]
      },
      {
        "source_row": 2,
        "source_locator": "HTML element #mwcQ",
        "label": "3",
        "text": "--kaθarongenoito",
        "representation": "secondary_roman_transcription",
        "partition": "grc",
        "partition_evidence": "Wikipedia section description; secondary attribution only",
        "analysis_eligible": false,
        "annotations": {
          "injured": false,
          "uncertain": true,
          "note": "Secondary transcription; not independently collated. Spaces and vacat labels preserved."
        },
        "tokens": [
          {
            "text": "--kaθarongenoito",
            "start": 0,
            "end": 16,
            "eligible": false,
            "reason": "source_marks_line_as_injured_or_uncertain"
          }